{
  "schema_version": "tbg-e2e-profiles/v1",
  "schema_path": "schemas/harness/e2e-validation-profiles.schema.json",
  "default_profile": "default-static",
  "posture": {"end_to_end_default_required": true, "unit_tests_sufficient_for_merge": false, "external_network_activity_default": false, "game_mutation_default": false, "tracked_runtime_evidence_allowed": false},
  "journeys": [
    {"id": "python-harness-contracts", "kind": "python", "script": "tests/harness/test_tbg_harness_contracts.py", "required": true, "network_scope": "none", "game_mutation": false, "proof_level": "contract-proof"},
    {"id": "powershell-harness-contracts", "kind": "powershell", "script": "scripts/Test-TbgAiHarness.ps1", "required": true, "network_scope": "none", "game_mutation": false, "proof_level": "contract-proof"},
    {"id": "debug-build-local-game-references", "kind": "dotnet-debug-build", "script": "src/BlacksmithGuild/BlacksmithGuild.csproj", "required": true, "network_scope": "package-restore-only", "game_mutation": false, "proof_level": "build-proof"},
    {"id": "read-only-runtime-artifact-observation", "kind": "operator-gated-runtime", "script": "forge.ps1", "required": true, "network_scope": "none", "game_mutation": false, "proof_level": "behavior-observed"},
    {"id": "disposable-save-live-certification", "kind": "operator-gated-runtime", "script": "forge.ps1", "required": true, "network_scope": "none", "game_mutation": true, "proof_level": "live-runtime-certified"}
  ],
  "profiles": [
    {"id": "default-static", "proof_class": "composed-static-e2e", "journey_ids": ["python-harness-contracts", "powershell-harness-contracts"]},
    {"id": "local-build", "proof_class": "local-build-e2e", "journey_ids": ["python-harness-contracts", "powershell-harness-contracts", "debug-build-local-game-references"]},
    {"id": "read-only-runtime", "proof_class": "operator-gated-runtime-observation", "journey_ids": ["python-harness-contracts", "powershell-harness-contracts", "read-only-runtime-artifact-observation"]},
    {"id": "disposable-save-live-cert", "proof_class": "operator-gated-live-runtime", "journey_ids": ["python-harness-contracts", "powershell-harness-contracts", "debug-build-local-game-references", "disposable-save-live-certification"]}
  ]
}
